{
  "adapter": "pytest",
  "capabilityLevel": "static-impact",
  "contractVersion": 1,
  "environment": {
    "architecture": "x64",
    "operatingSystem": "linux"
  },
  "features": [],
  "generatedAt": "2026-07-30T00:00:00.000Z",
  "protocolVersion": 1,
  "runner": {
    "name": "pytest",
    "version": "8.4"
  },
  "scenarios": [
    {
      "evidence": {
        "assertions": 3,
        "command": "python3 -m unittest discover -s tests -v",
        "fixture": "tests/test_pytest_adapter.py"
      },
      "id": "baseline-full",
      "passed": true
    },
    {
      "evidence": {
        "assertions": 2,
        "fixture": "tests/test_pytest_adapter.py"
      },
      "id": "no-change-skip",
      "passed": true
    },
    {
      "evidence": {
        "assertions": 2,
        "fixture": "tests/test_pytest_adapter.py"
      },
      "id": "affected-selective",
      "passed": true
    },
    {
      "evidence": {
        "assertions": 2,
        "fixture": "tests/test_pytest_adapter.py"
      },
      "id": "unknown-change-full",
      "passed": true
    },
    {
      "evidence": {
        "assertions": 1,
        "fixture": "../../conformance/protocol/v1/plans.json"
      },
      "id": "structural-change-full",
      "passed": true
    },
    {
      "evidence": {
        "assertions": 1,
        "fixture": "tests/test_pytest_adapter.py"
      },
      "id": "corrupt-graph-full",
      "passed": true
    },
    {
      "evidence": {
        "assertions": 1,
        "fixture": "../../conformance/protocol/v1/plans.json"
      },
      "id": "environment-change-full",
      "passed": true
    },
    {
      "evidence": {
        "assertions": 2,
        "fixture": "tests/test_pytest_adapter.py"
      },
      "id": "cross-platform-paths",
      "passed": true
    },
    {
      "evidence": {
        "assertions": 1,
        "fixture": "../../conformance/protocol/v1/plans.json"
      },
      "id": "resource-locks",
      "passed": true
    }
  ],
  "selectionGranularity": "test-file",
  "sourceRevision": "sha256:5d7e513296dfa585bcec7c01be7c26acd8a21b63e6dcdd7f9b7581cb727a4ecc"
}
